Number,Name of the graha / planet,Sanskrit Name,Botanical name,English name,Malayalam Name,Kannada Name,Description,Geographical distribution,Chemical constituents,Important Therapeutic use,Other medical uses,Ayurvedic uses ,Google drive Album,Reference/Futher Reading Link,Adopter Name,Adopter contact
1,Budha / Mercury,Apamarga,Achyranthes aspera L,Prickly chaff flower,"Katalati
കടലാടി
","Utrani 
ಉತ್ರಾಣಿ
","Achyranthes aspera is an annual herb that can grow up to 1-2 meters in height. It has an erect, stout stem; simple, opposite, and oblong leaves; and small greenish flowers that form in axillary or terminal spikes. The seeds are encapsulated in a utricle, and the plant is distinguished by its rough texture.","It is distributed throughout the tropical world. It can be found in many places growing as an introduced species and a common weed. It is an invasive species in some areas, including many Pacific Islands environments.","Betaine, Achyranthine, Hentriacontane, Ecdysterone; achyranthes saponins A,B,C,D.","Apamarga is an excellent diuretic. Hence useful in dysuria, urinary retention, water retention and urinary stones; It helps to break down the kidney and bladder stones. This action is not only due to its diuretic action.","Antihypertensive - to treat blood pressure
Anti diabetic - to treat blood sugar
Abortifacient - causing abortion
Diuretic - to increase urine production
Purgative - to loosen stool
Spasmolytic - to relieve muscle stiffness Hypoglycemic - to decrease blood sugar
Anti fungal - to treat fungal infection","Breaks down and expels sputum collection. 
Useful in piles, hemorrhoid's. 
Useful in relieving pruritus (excessive itching). 
Useful in ascites. 
Relieves ama - a product of indigestion and altered metabolism.
Improves blood. An excess dose may cause nausea and vomiting.
Improves digestion strength. 
It helps to relieve worms and infections in head and neck region. 
Relieves bloating, balances Vata Dosha. 
Relieves abdominal colic pain. 
Relieves hiccups. 
Useful in piles, hemorrhoid's. Ueful in urticaria, itching, allergic skin rashes. 
Useful in fibroids, glandular growths. 
Improves taste, relieves anorexia. 
Useful in cardiac disorders with cholesterol deposition in blood vessels. 
Relieves bloating, gaseous distension of abdomen. 
Fruit is sweet in taste, hard to undergo digestion, useful in bleeding disorders.",https://drive.google.com/drive/folders/1prrSZCTmEZ-gCztD__FY3fV7c3FI2gwq?usp=sharing,https://www.easyayurveda.com/2014/11/20/apamarga-achyranthes-aspera-uses-dose-side-effects/#varieties_distribution,,
2,Sukra / Venus,Udumbara,Ficus racemosa L,Cluster fig ,"Atthi
അത്തി
","Atthi
ಅತ್ತಿ
","Cluster fig trees, belong to the Moraceae family. They are known for their unique fruiting habit; the fruits grow in clusters directly from the main trunk and larger branches of the tree, hence the name ""Cluster fig.""
Cluster fig trees can grow up to 25-30 meters in height. They have a wide canopy with large, spreading branches. The leaves are broad, ovate, and have a glossy appearance. The fruit is small, round, and turns from green to red or purple as it ripens.
Unlike other fruit trees, cluster figs do not flower externally. Their flowers are inside the fruit, which provides a home for specific wasps to pollinate them in a unique example of mutualism.","It is predominantly found in South and Southeast Asia, notably in India, Sri Lanka, Bangladesh, and Malaysia, and extends to northern and eastern Australia, as well as parts of eastern and southern Africa","Leaves & Fruits- Gluacol
Fruits- B- Sitosterol, ceryl behenate, Lupeol, Friedelin ",,"For Using on the Skin:
It can help with pain, heal wounds, and reduce swelling.
The sap from the plant helps with swelling, wounds, and more.
The young leaves can be put on the skin to make it look better.
Boiling the leaves in water makes a liquid that can clean wounds and help with mouth problems when used as a mouthwash.
For Taking by Mouth:
Digestive System:
It can soak up substances in the stomach, calming an upset stomach.
Eating the ripe fruit might make worms grow in the intestines.
Boiling the bark in water helps with bleeding from the rear end, trouble absorbing nutrients from food, and more. The sap is also good for young children to help prevent issues when they are getting new teeth.
Blood System:
The bark and fruit help stop bleeding.
Reproductive System:
A special treatment using the bark helps with excessive vaginal discharge, heavy menstrual bleeding, and bleeding at unexpected times. It's also good for keeping a pregnancy healthy and helping the baby grow. The sap helps prevent releasing too soon during sex.
Peeing System:
It makes you pee less and is good for diabetes when using the bark or fruit.
For Heat-Related Problems:
Eating the ripe fruit is good for conditions that make you feel like you're burning up.","Breaks down and expels sputum collection.
Useful in piles, hemorrhoids.
Useful in relieving excessive itching.
Useful in ascites.
Relieves a product of indigestion and altered metabolism.
Improves blood. An excess dose may cause nausea and vomiting.
Improves digestion strength.
Helps to relieve worms and infections in the head and neck region.
Relieves bloating, balances body energy.
Relieves abdominal colic pain.
Relieves hiccups.
Useful in piles, hemorrhoids.
Useful in urticaria, itching, allergic skin rashes.
Useful in fibroids, glandular growths.
Improves taste, relieves lack of appetite.
Useful in cardiac disorders with cholesterol deposition in blood vessels.
Relieves bloating, gaseous distension of the abdomen.
Fruit is sweet in taste, hard to digest, useful in bleeding disorders.
",https://drive.google.com/drive/folders/1y3SZrouXFIbYO4IXWlv5246GP6s44P-E?usp=drive_link,https://www.easyayurveda.com/2014/12/16/udumbar-ficus-racemosa-uses-research-side-effects/,,
3,Chandra / Moon,Palasa,Butea monosperma (Lam.) Kuntze,Flame of the Forest,"Plashu
പ്ലാശ്
","Muttaga
ಮುತ್ತಗ
","Height and Structure: Butea monosperma can grow up to 15 meters tall. It has a crooked trunk and spreading branches, forming a broad crown.
Leaves: The leaves are pinnate, with three leaflets, and are shed during the winter months, rendering the tree leafless when it blooms in spring.
Flowers: The flowers are bright orange-red, appearing in dense clusters. Each flower is shaped like a parrot’s beak, which is especially attractive to birds and insects.
Fruit: The tree produces pods that are flat, leathery, and contain only one seed, hence the species name ""monosperma"" (mono = single, sperma = seed).","It is primarily found in the Indian Subcontinent, including India, Nepal, Sri Lanka, Bangladesh, and Pakistan. It also grows in Southeast Asia, covering areas in Myanmar, Thailand, Laos, Cambodia, and Vietnam. Its distribution reflects a preference for tropical and subtropical environments, thriving in a variety of habitats such as forests, grasslands, and alongside roads and riverbanks","Leaves of butea are rich in glucoside, linoleic acid, oleic acid and lignoceric acid. Bark contains gallic acid, palasitrin, butrin, butolic acid, cyaniding, Lupenone and palasimide. Gum contains tannins, pyrocatechin and mucil isaginous materials. Flowers are rich in flavonoids, triterpene, butein,
butin, isobutrin, coreopsin, isocoreopsin and sulphurein.","Commonly known as Flame of the Forest, Palash, or Bastard Teak, is a species of tree native to tropical and subtropical parts of the Indian Subcontinent and Southeast Asia. It belongs to the family Fabaceae, the pea family. This tree is well-known for its striking orange-red flowers, which appear in clusters and cover the entire canopy of the tree, making it look like it is on fire, hence the name ""Flame of the Forest.""","Wound Healing: Applied externally to heal cuts and bruises.
Anti-inflammatory: Used to reduce inflammation and pain, beneficial in conditions like arthritis.
Antioxidant: The flowers offer antioxidant benefits, protecting against cellular damage.
Diuretic: Flowers help in promoting urination, aiding in detoxification and urinary tract health.
Anti-diabetic: Flowers are used to help manage blood sugar levels.
Anthelmintic: Seeds are effective against intestinal worms.
Contraceptive: Seeds have been used traditionally for their contraceptive properties.
Astringent: The bark is used to treat diarrhea and dysentery, helping to control loose stools.
Skin Diseases: Used in treating skin conditions due to antimicrobial and anti-inflammatory properties.
Eye Health: Employed in traditional remedies for improving eye health and treating infections.
Fever Reduction: Has antipyretic properties to help lower fever.
Detoxification: Used in traditional medicine for blood purification and toxin elimination.","It comprise anti-diarrheal, anthelmintic, anti-diabetic, anti-stress, hepatoprotective, antifungal, astringent, aphrodisiac, laxative, anti-inflammatory and antioxidant qualities. The Palash flowers and leaves are diuretic, aphrodisiac, astringent and increase the flow of blood in the pelvic region. The seeds of the tree have purgative, diuretic to stimulate the production of urine and anthelmintic i.e. anti-parasitic properties. The seed powder is used in the case of intestinal parasites. Palash tree bark yields a gum which is known as kino, that houses astringent properties to treat haemorrhoids.",https://drive.google.com/drive/folders/1PzMHSStVmqIi_0DPXsdZZe-0EuJQex52?usp=drive_link,https://www.planetayurveda.com/library/palasha-butea-monosperma/,,
4,Guru / Jupiter,Ashvatha,Ficus religiosa L.,Sacred fig,"Arayal
അരയാൽ
","Arali
ಅರಳಿ
","Ashwattha (Peepal tree) is a well known religious tree appreciated all over India. Ayurveda uses stem bark, fruits, root, leaf, milk, tender shoots, in various medicines and remedies.Ashwattha tree is well known for its wound healing, absorbent, memory enhancing and complexion enhancing properties. As per astrology and Hindu philosophy it is useful in infertility cases as well.
Peepal is unrivalled for its antiquity and religious significance. No other tree is claimed to have such long life - one in Sri Lanka, said to have been planted in the year 288 B.C., still lives and flourishes. The Prince Siddhartha is known to have sat in meditation under a Bo tree and there found enlightenment from which time he became known as the Buddha. So, from then on the tree was sacred to Buddhists. Hindus associate the tree with the three gods Brahma, Vishnu and Shiva, Vishnu being reputed to have been born under a Peepul, which is therefore Vishnu himself in the form of a tree. A grand peepal tree is a perfect shade tree, and village meetings are often conducted under a peepal tree. It is a large deciduous tree with a pale stem often appearing fluted on account of the numerous roots which have fused with the stem. Leaves leathery 4-8 inches long by 3-5 inches wide, somewhat egg-shaped or rounded, tailed at the tip and heart-shaped at the base, or sometimes rounded. The young leaves are frequently pink, change to copper and finally to green. Flowers minute within the receptacle. Fruit is a fig."," It is geographically distributed primarily in the Indian subcontinent, extending to parts of Southeast Asia. Its native range includes countries such as India, Nepal, Bangladesh, Pakistan, Sri Lanka, southwest China, and Indochina (including Thailand, Vietnam, and Cambodia). Due to its cultural significance and adaptability, it has also been introduced and naturalized in other tropical and subtropical regions around the world. The tree thrives in a variety of climatic conditions, from temperate to tropical environments, making it a common sight in both rural and urban landscapes within its native and introduced ranges.","The phytoconstituents found in Aswatha are phenols, tannins, steroids, alkaloids and flavonoids, ß-sitostery|-D-glucoside, vitamin K, n-octacosanol, methyl oleanolate, lanosterol, stigmasterol, lupen-3-one, essential amino acids, isoleucine, and phenylalanine, phytosterolin, albuminoids, carbohydrate, fatty matter, kaempeferol, quercetin, and myricetin, carbohydrate, protein, lipid, calcium, sodium, potassium, and phosphorus. The aqueous extract of bark of
Aswatha contains phytosterols, flavonoids, tannins, bergapten and begaptol.","Ashwattha (Peepal tree) is a well known religious tree appreciated all over India. Ayurveda uses stem bark, fruits, root, leaf, milk, tender shoots, in various medicines and remedies.
Ashwattha tree is well known for its wound healing, absorbent, memory enhancing and complexion enhancing properties. As per astrology and Hindu philosophy it is useful in infertility cases as well.","• The tree is useful in the treatment of chronic ulcers, stomatitis, menstrual irregularities, diarrhea, diabetes, epilepsy, and gastric disturbances, infertility and infectious disorders.
• The milky latex obtained from the bark, root or fruit of the plant is given in a dose of 5-6 drops with honey and ghee to treat impotence and help in conceiving in females.
• The decoction of the bark or root of Ficus religiosa is given in a dose of 50-60 ml to treat joint swelling and pain.
• The tender leaves of Ashwattha and Vata (Ficus bengalensis) are made into paste and applied over the skin having black heads, pimples and discoloration to get the original skin tone.
• Latex of Ficus religiosa is applied over wounds and bleeding spots to heal wound and control bleeding respectively.
• Decoction of the bark of the tree is given in a dose of 50-60 ml to control diabetes and treat diseases of the vaginal tract.
• The dried powder of the fruits or the paste of the bark is given with honey or sugar candy to treat severe cough.
• Cold infusion or decoction prepared from the trunk bark or fruit of Ashwattha is consumed in a dose of 50 ml to treat skin diseases and acts like blood purifier.
• In pregnant women, the decoction of the bark of Ficus religiosa helps in strengthening the uterine muscles and retains the fetus till full term","External Uses:
Improving Skin Health: Applying leaf buds can enhance skin complexion.
Wound Healing: Bark powder accelerates wound healing when applied externally.
Reducing Inflammation and Pain: The plant's latex helps alleviate pain and inflammation and can stop bleeding.
Treating Mouth and Skin Issues: A bark decoction is beneficial for mouth ulcers, fistula, and inflammatory skin conditions.

Digestive System:
Absorbing and Soothing: The bark helps absorb substances and soothe the digestive tract.
Managing Digestive Disorders: Bark decoction can treat vomiting and diarrhea. Ripe fruit, being mildly purgative, can ease constipation and abdominal pain.

Circulatory System:
Blood Disorders: The fruit and bark can treat bleeding disorders and rheumatic complaints, with a bark decoction and honey mixture recommended for the latter.
Respiratory System:
Cough and Asthma Relief: The bark helps relieve cough by balancing mucus, and the fruit is helpful for asthma.

Reproductive System:
Enhancing Fertility and Pregnancy Support: The plant parts are known to support fertility and pregnancy. Fruit powder can be used for pregnancy support, while a boiled mixture of fruit, root, bark, or leaf buds in milk, with sugar and honey, can act as an aphrodisiac.

Excretory System:
Diabetes and Urine Production: It can reduce urine output and is recommended for diabetes, using bark decoction or fruit.",,https://www.easyayurveda.com/2017/05/23/bodhi-tree-ficus-religiosa/,,
5,Kuja / Mars ,Khadirah,Acacia catechu (L. f.) Willd,Senegalia chundra,"Karingali
കരിങ്ങാലി
","Kaggali
ಕಗ್ಗಲಿ ","Senegalia chundra is a small to medium-sized tree that can grow up to a certain height, typically characterized by its thorny branches and compound leaves. The leaves are bipinnate, which means they are composed of several small leaflets arranged on either side of a common axis. The tree produces yellow to golden-yellow flowers, which are small and fragrant, arranged in spherical heads.","This species is native to the Indian subcontinent, where it thrives in dry and deciduous forests. It is well adapted to arid and semi-arid environments and can often be found in areas with well-drained soils.","
Senegalia chundra contains a variety of bioactive compounds, including tannins, which are prevalent in its bark and used for tanning leather and possessing antimicrobial properties. Flavonoids and phenolic acids contribute to its antioxidant and potential health benefits. Alkaloids and glycosides in the plant have been noted for their medicinal properties, such as analgesic and anti-inflammatory effects. Additionally, the heartwood and bark are sources of natural dyestuffs, used traditionally for producing red dye. These components together underline the plant's significance in traditional medicine, dye production, and the tanning industry.","
Senegalia chundra is traditionally used for its antimicrobial, anti-inflammatory, and antioxidant properties, aiding in treating infections, reducing inflammation, and preventing oxidative stress. Its astringent qualities are beneficial for gastrointestinal and dermatological issues, such as diarrhea, skin wounds, and infections. These uses are supported by its content of tannins, flavonoids, and other bioactive compounds.","The tree is useful in the treatment of chronic ulcers, stomatitis, menstrual irregularities, diarrhea, diabetes, epilepsy, and gastric disturbances, infertility and infectious disorders.The milky latex obtained from the bark, root or fruit of the plant is given in a dose of 5-6 drops with honey and ghee to treat impotence and help in conceiving in females.
The decoction of the bark or root of Ficus religiosa is given in a dose of 50-60 ml to treat joint swelling and pain.
The tender leaves of Ashwattha and Vata (Ficus bengalensis) are made into paste and applied over the skin having black heads, pimples and discoloration to get the original skin tone.
Latex of Ficus religiosa is applied over wounds and bleeding spots to heal wound and control bleeding respectively.
Decoction of the bark of the tree is given in a dose of 50-60 ml to control diabetes and treat diseases of the vaginal tract.
The dried powder of the fruits or the paste of the bark is given with honey or sugar candy to treat severe cough.
Cold infusion or decoction prepared from the trunk bark or fruit of Ashwattha is consumed in a dose of 50 ml to treat skin diseases and acts like blood purifier.
In pregnant women, the decoction of the bark of Ficus religiosa helps in strengthening the uterine muscles and retains the fetus till full term.","Skin Health
Its powder or extract is applied to skin ailments, including acne, eczema, and psoriasis, due to its antimicrobial and anti-inflammatory properties.

Digestive Health
Ayurvedic practices utilize Senegalia chundra in managing digestive issues, leveraging its astringent properties to treat diarrhea, dysentery, and intestinal ulcers.

Detoxification
It is believed to have blood-purifying properties in Ayurveda, used in detoxifying the body and improving liver function.

Dental Care
Due to its astringent and antimicrobial properties, it's used in dental care for treating gum diseases and toothaches in Ayurvedic medicine.

Fever and General Weakness
Ayurvedic remedies include Senegalia chundra for treating fever and boosting general health and vitality, attributing to its overall strengthening effects on the body.",,https://indiabiodiversity.org/species/show/31942,,
6,Surya / Sun,Arka,Calotropis gigantea (L.) Dryand.,,"Erukku
എരുക്ക്","Ekka
ಎಕ್ಕ",,,,,,,,,,
7,Kethu / South Lunar Node,Darbha,Desmostachya bipinnata (L.) Raeusch.,Cogon grass ,"Darbhapullu 
ദർഭപ്പുല്ല്  
","Darbhehullu 
ದರ್ಭೆಹುಲ್ಲು","Imperata cylindrica, commonly known as cogon grass, is a 
perennial grass with slender stems that form dense clumps, 
reaching heights of 1 to 2 meters. The plant features long, 
narrow leaves with serrated edges and distinctive silver-white 
plumes during its flowering season. Its aggressive growth is 
facilitated by an extensive rhizomatous system, allowing it to 
spread rapidly and outcompete native vegetation. Cogon grass 
is recognized as an invasive species, posing ecological threats 
by disrupting ecosystems, reducing biodiversity, and increasing 
the risk of wildfires. Efforts are often undertaken to control its 
spread and mitigate its impact on native environments.","Imperata cylindrica, commonly known 
as cogon grass, is a perennial grass 
species with a wide geographical 
distribution. It is native to many 
regions in Asia and Australasia but 
has also been introduced to other 
parts of the world. ","Silica:
Imperata cylindrica is known for its high 
silica content. Silica is found in the plant's tissues, 
contributing to its toughness and durability.

Flavonoids:
Flavonoids are a group of polyphenolic 
compounds with antioxidant properties. 
They are present in various parts of the plant, 
including the leaves and stems.

Triterpenoids:
Triterpenoids are a class of compounds 
with diverse biological activities. 
They are often found in the roots 
of Imperata cylindrica.

Alkaloids:
Some alkaloids have been identified in 
Imperata cylindrica, although the specific 
types and quantities may vary.

Coumarins:
Coumarins are aromatic compounds with 
various biological activities. They are found 
in certain plants, including Imperata cylindrica.

Steroids:
Steroids, including phytosterols, are present 
in the plant. These compounds can have 
diverse physiological effects.

Lignans:
Lignans are polyphenolic compounds with 
antioxidant properties. They have been 
reported in some studies on Imperata cylindrica.

Phenolic Acids:
Phenolic acids, including hydroxycinnamic 
acids and other derivatives, are part of the 
plant's chemical composition.

Essential Oils:
Some studies suggest the presence of 
essential oils in Imperata cylindrica, 
contributing to its aromatic properties","Cogon grass is traditional medicine empirically used in 
nephritis, fever, hypertension, dyspnea, epitaxy, as a 
hepatoprotector agent, and has function to 
lower cholesterol and blood glucose. 
The compound of cogon grass is potentially 
served as an herbs medicine.","Diuretic Properties:
Imperata cylindrica has been traditionally used as 
a diuretic in some cultures. It is believed to promote 
urine production, which may be helpful in conditions 
related to fluid retention.

Anti-Inflammatory Activity:
Some studies have suggested that Imperata cylindrica 
possesses anti-inflammatory properties. Compounds 
like flavonoids and triterpenoids found in the plant may 
contribute to this potential benefit.

Antioxidant Effects:
The presence of flavonoids and other antioxidants in 
Imperata cylindrica may contribute to its ability to 
scavenge free radicals and protect cells from oxidative stress.

Antimicrobial Activity:
Extracts from Imperata cylindrica have shown some 
antimicrobial activity in laboratory studies. 
This suggests a potential role in combating certain 
types of bacteria and fungi.

Hemostatic Properties:
In traditional medicine, Imperata cylindrica has been 
used for its hemostatic (bleeding-stopping) properties. 
This use may be attributed to its high silica content, 
which can contribute to the plant's ability to form a 
protective barrier.
Anti-Diabetic Potential:

Some research has explored the anti-diabetic potential 
of Imperata cylindrica. It has been investigated for its 
ability to lower blood sugar levels, but more studies
 are needed to validate these effects.

Wound Healing:
Traditional uses include the application of Imperata 
cylindrica extracts to wounds for their potential 
wound-healing properties. Again, this may be related 
to the plant's silica content and its ability to provide 
a protective layer.

Anti-Cancer Properties:
Preliminary studies have investigated the potential 
anti-cancer properties of Imperata cylindrica extracts, 
particularly due to its triterpenoid content. ","Sushruta Samhita:
In the Sushruta Samhita, an ancient Ayurvedic text, 
Darbha grass is mentioned for its medicinal properties.
It is believed to have cooling and hemostatic 
(bleeding-stopping) qualities.

Wound Healing:
Darbha grass has been traditionally used in Ayurveda 
for wound healing. It is applied topically to wounds to 
aid in their recovery, and this is believed to be due to 
its hemostatic and protective properties.

Pitta Balancing:
Ayurveda categorizes herbs and substances based 
on their impact on the three doshas: Vata, Pitta, and 
Kapha. Darbha grass is considered to have a cooling 
effect and is often associated with balancing Pitta dosha.

Sacred Use in Rituals:
Darbha grass is considered sacred in Hindu rituals and 
ceremonies. It is often used as part of religious rituals 
and as a seat or mat for performing certain ceremonies.

Spiritual Significance:
In Ayurvedic and Vedic traditions, Darbha grass is 
believed to have spiritual significance. It is used in rituals, 
especially during Yajnas (fire ceremonies), 
and is considered purifying.",,,,
