Number,Type,Category,Sanskrit Name,Botanical name,English name,Malayalam Name,Kannada Name,Description,Geographical distribution,Chemical constituents,Important Therapeutic use,Other medical uses,Ayurvedic uses ,Google drive Album,Reference/Futher Reading Link,Adopter Name,Adopter contact
7,Nakshatra,"Nakshatra
Punarvasu",Vamsha,Bambusa vulgaris Schrad. ex J.C.Wendl.,Bamboo,"Mula
മുള","Biduru
ಬಿದುರು","Bambusa vulgaris is an erect, evergreen, clump-forming bamboo growing 15 - 20 metres tall . It grows in loose clumps that are free of thorns, has dark green leaves and lemon-yellow stems mostly with green stripes. The stems are initially tough, not straight or can split easily, stiff in nature, and have thick walls with narrow lanceolate leaves. The densely tufted stems are 4-10 cm thick and reach heights upto 10-20 m. The trunk can be flexible (alternately bent in various directions) or straight, drooping at the ends. The walls of the trunk are quite thick, and nodes grew marginally. The internodal segment is 20 to 45 cm. There may be sprouting of a few branches between the middle trunk nodes to the top . New bamboo culms that emerge from the ground (bamboo sprouts) are  edible . It's a vegetable that's used in a variety of Asian dishes and broths. They are sold in a variety of processed shapes and come in fresh, dried, and canned varieties. Among all the different species of bamboo shoots available in the world, only some of them are edible.","Bamboo grows worldwide in at least 37 million hectares and covers 3.2 % of forest areas of their host countries or about 1 % of the global forest area. The southern tropical region of Asia contains about 80% of the area covered in bamboo.In Asia, Africa, and America bamboo is widely distributed. The Southeast Asia monsoon zone (south-eastern China, Indo-China, and the Indian subcontinent) is the world's bamboo distribution center; it is home to 90% of the world's total bamboo forest area as well as 80% of all bamboo species. There are numerous bamboo species in both America and South Africa. The distribution centre for bamboo is located in Latin America, specifically in the Amazon Basin near theSouth Tropic of Cancer, which includes Mexico, Guatemala, Costa Rica, Nicaragua, Honduras, Colombia, Venezuela, and Brazil. And the east coast of Madagascar is the centre of African bamboo distribution . India is the second richest country in the world, after China, in terms of bamboo genetic resources .  The bamboo area of the country is estimated to be 15.69 million hectares with a total standing stock of 189 million tons .","74% of bamboo constitutes cellulose which provides structural strength and rigidity. It also contains  Hemicelluloses and Lignin: Bamboo also contains minor components such as pigments, tannins, protein, fat, pectin, and ash. Bamboo shoots are a good source of both macro and microelements.They are also good source of  vitamin C and E.","The tender shoots of the bamboo is also made into paste and applied over the area affected with ringworm, discoloration of the
skin etc.
The dried resin called as 'Vamshalochana' is made into powder and mixed with honey and given to treat cough, cold and fever.
Vamshalochana is taken in a dose of 3 - 5 g and mixed with hot water or buttermilk and given to treat indigestion, diarrhea and
nausea.
Paste of Bamboo shoot or tender buds is made into paste and applied over wounds as part of treatment.
Decoction of the leaves is given in a dose of 40 - 50 ml to treat dysmenorrhea, pain in abdomen during menstruation and to
strengthen the uterine muscles after delivery.
Decoction of the root is given in a dose of 40 - 50 ml to treat adverse effect due to dog bite and scorpion bite.
In case of diabetes, the seed of bamboo is made into edible food and given as regular diet.
The decoction of the tender leaves of bamboo is given in a dose of 40 - 50 ml to treat intestinal worm infestation.
Charaka ->Eatables prepared from bamboo seed eaten by asses, horses, cows, swans and deer and collected from their dung
should be given to the patient suffering from Prameha
If there is pain in piles, then it should be well smeared with medicated oil and the patient should be given, bath with the help of
water prepared by above mentioned drugs.
Sushruta - Ras kriya preparation prepared with the root of bamboo vartis prepared with the same of it, cooking it in a vessel,
should be used for Anjana.",,,https://drive.google.com/drive/folders/1IFDz8WaT-Ywx-yTEp5XMnt2ryXSS9WZG,https://etflin.com/article/59,"Vaniya Ganiga Samaja Seva Sangha, Perne",
8,Nakshatra,"Nakshatra
Pushyami",Ashvatha,Ficus religiosa L.,"Peepal Tree, Sacred Fig","Arayal
അരയാൽ","Arali
ಅರಳಿ","Sacred fig is a large tree, growing to a height of 20-25 meters and 2-3 meters in diameter. The bark of the tree is pale brownish white. The leaves are cardiac shaped at the base and elongated at the tip. The fruits are small and green when unripe and turn to blackish color when ripe. People belonging to Hindu and Buddhist religions consider the tree as sacred.","The peepal tree is native to the Indian subcontinent and Indochina. It is found in Bangladesh, Bhutan, Nepal, Pakistan, India, and parts of Indochina, including the Andaman Islands, Thailand, Myanmar, and Peninsular Malaysia.","The bark of the tree contains beta- sitosterol-D-glucoside, Vit.K, n- octacosanol, methyl oleanolate, lanosterol and stigmasterol. The fruit contains about 5% protein having essential amino acids, isoleucine and phenylalanine. Sacred Fig leaves contain a high amount of tannic acid, minerals like iron, copper, calcium, zinc and manganese.They also contain leucine, isoleucine, methionine,tryptophan, threonine, glycine aspartic acid, serine and arginine. The fruit consists of tyrosine and asparagines in significant amounts. The seeds possess threonine, alanine and valine.","The tree is useful in the treatment of chronic ulcers, stomatitis, menstrual irregularities, diarrhea, diabetes, epilepsy, and gastric disturbances, infertility and infectious disorders.","The milky latex obtained from the bark, root or fruit of the plant is given to treat impotence.
The decoction of the bark or root is given to treat joint swelling and pain.
The tender leaves of Ashwattha and Vata are made into paste and applied over the skin having black heads, pimples and discoloration to get the original skin tone.
The Latex is applied over wounds and bleeding spots to heal wounds and control bleeding.
Decoction of the bark of the tree is given to control diabetes .
The dried powder of the fruits or the paste of the bark is given with honey or sugar candy to treat severe cough.
They also act like blood purifiers.
In pregnant women, the decoction of the bark helps in strengthening the uterine muscles and retains the fetus till full term.
Gargling with lukewarm decoction of the bark of Ashwattha is useful to treat mouth ulcers and gingivitis.","Nalpamaradi Tailam: Used for the treatment of Herpes, Scabies, Eczema, Dermatitis, allergic skin diseases such as ringworm infestation etc
Arimedadi Tailam:Used for the treatment of oral diseases like gingivitis, bleeding of gums, bad breath( gargling purposes)
Sarivadyasava: It is a liquid preparation used for diabetes and skin complications, gout, rheumatism.
Panchavalkaladi Tailam: Used to treat skin diseases such as eczema and dermatitis.
Dermosooth ointment: Used to treat rheumatoid arthritis, burning sensation and improves the complexion of skin.",https://drive.google.com/drive/folders/1ArH3W0AAoyAPIwh8EAbQ4modescVFpKn,https://www.easyayurveda.com/2017/05/23/bodhi-tree-ficus-religiosa/,"Vaniya Ganiga Samaja Seva Sangha, Perne",
9,Nakshatra,"Nakshatra
Aashlesha",Nagakesara,Messua ferrea L.,Cobra saffron,"Nagacempakam
നാഗസമ്പകം","Nagasampige
ನಾಗಸಂಪಿಗೆ","This is an evergreen, large and glabrous tree.
Trunk is straight and erect.
Bark is smooth and ash reddish brown in colour.  Wood is red, hard and heavy.
Leaves are 8.0-15.0 cm long, oblong-lanceolate, acute, red when young, afterwards shining above, glaucous, rounded at the base and with close inconspicuous veins. Petioles are short.
Flowers are white, hermaphrodite or polygamous, fragrant, 2 to 10 cm across axillary, solitary or sometimes in pairs.","Plant is commonly distributed in mid-hills of Eastern Himalayas and rain forests of Konkan and Karnataka in Western Ghat.
Plant is also distributed in Nepal eastwards, in north-eastern India, Deccan Peninsula and in the Andaman Islands.","It contains Mesuol, Mammeuisin, Mammegin, bioflavonone called Mesuaferrone A, etc.
Important chemical constituents of the plant are Mesuol, Mammeisin, Mesuagin, Mammeigin, Mesuabixanthone A, Mesuabixanthone
B, Mesuaferrol, Mesuaxanthone A, Euxanthone, Mesuaxanthone B, Messianic acid, Mesuaferrone A and Mesuaferrone B","It is a very famous Ayurveda herb used in treating fever, vomiting, urinary tract disorders, migraine etc. It is one among Chaturjata group of herbs. It is used in powder form along with other spices, and is used in many herbal jams including Chyawanprash.","Flowers are astringent, stomachic, expectorant, made into paste with butter and used in bleeding piles and burning feet.
Powdered  flower bud is mixed with honey is given in blood dysentery, piles and leucorrhea.
Bark acts as tonic after childbirth and also   useful in anemia.
Bark and unripe fruit are sudorific. Leaf and flower are antidysenteric.
Flower acts as stomachic, expectorant and used in piles & burning of the feet.
Seed oil  is antirheumatic and used in skin diseases.",,https://drive.google.com/drive/folders/1gDGk2WLoKhQE0khud5I4EA7j4flME5c5?usp=drive_link,"Nagkesar - Mesua ferrea Uses, Research, Side Effects (easyayurveda.com)","Vaniya Ganiga Samaja Seva Sangha, Perne",
10,Nakshatra,"Nakshatra
Magha",Nyagrodha,Ficus benghalensis L.,,"Peral
പേരാൽ","Aala
ಆಲ","It is a big tree distributed all over India in the temperate climate, growing to a height of 15-20 meters and wide in radius. Aerial roots are found hanging from the tree which, on touching the ground, gives support to the branches. The tree bark is thick, whitish colored. The leaves are thick, oval, 4-6 inches long. The fruits are red, round. The flowers are not visible in the tree. The male and female flowers are enclosed in axillary, sessile, depressed red fruits. New tender buds are seen in the summer season along with the fruits.","It is endemic to India and the sub-Himalayan region, and inhabits evergreen and semi-deciduous forest.","The aerial root contains Phytosterols. Leaves contain Triterpin, Friedelin and Beta sitosterol. The bark of the tree contains a glucoside, Bengalinoside and flavonoid glycosides, Leucocyanidin and Leucopelargonidin. Heartwood contains esters of alpha- tatraxasterol and
Liglic acid.
Bark - Hypoglycemic principle, Glycoside Leaves - Triterpin, Friedelin, Sitosterol
Heart wood - Ester of - tatraxasterol, Liglic acid, Bengalenoside","Used for the treatment of wounds, skin diseases, eye diseases, leucorrhea, diabetes and diarrhea. It is called Vata in Ayurveda.","• The milky latex of Vata is applied directly over the wound and swelling for quick relief.
• The decoction of the bark of Ficus benghalensis is given in a dose of 50-70 ml to treat vaginal diseases.
• To control diabetes, the decoction of the bark of Vata or the fruit is given.
• In order to strengthen the uterine muscles during pregnancy, the tender leaves of Vata are given the form of decoction
• The latex of the Banyan tree is called Bargad ka doodh in Hindi. It is used to treat cases of premature ejaculation.
• Latex of Vata is applied locally in dental caries, conjunctivitis and skin diseases as part of treatment.
• For the firmness of the breasts in females, the paste of the aerial roots is applied locally.
• To treat diarrhea, the buds of Ficus benghalensis are added with Ficus religiosa and Ficus glomerata and processed with ghee and mixed with honey and sugar candy for consumption.
• To treat nausea and vomiting, the decoction prepared from leaf buds of Vata, Jambu and Ushira is taken with honey in a dose of 40-50 ml.
• Person affected with viper snake poisoning, paste of root of banyan tree is mixed with juice of Durva, Manjishta, Jivaka and Kashmarya and consumed.
• In excessive sweating, cold infusion from the tender buds of Ficus benghalensis is given in a dose of 40-50 ml.",,https://drive.google.com/drive/folders/1i4luJzHTslOQdSm0xBqAIZ1xlBAg-B6z?usp=drive_link,https://www.easyayurveda.com/2017/05/22/banyan-tree-ficus-benghalensis/,"Vaniya Ganiga Samaja Seva Sangha, Perne",
11,Nakshatra,"Nakshatra
Pubba",Palasa,Butea monosperma (Lam.) Kuntze,Palash,"Plashu
പ്ലാശ്","Muttaga
ಮುತ್ತಗ","It is a small-sized deciduous tree growing almost 15 m tall. The leaves has three leaflets.The flowers are bright orange-red,each flower features five petals, two wings, and a keel that resembles the curled beak of a parrot. The fruit is a pod.Seeds are flat Kidney shaped. Surface is leathery, glossy veined and wrinkled with a deep reddish brown color.  Seed does not have any odor.",The tree is found in all parts of India .,Bark and stem of the plant contains kino and tannic acid. Gallic acid is also found in significant amounts. The seeds contain kino oil which is a potent wormicide.,"Useful in digestion,abdominal disorders and promotes bowel movement. Brings about quick wound  and  fracture healing,relieves mal-absorption syndrome,useful in hemorrhoids and intestinal worms.","Palash bark decoction is used for menstrual irregularities.
Flower paste for skin discoloration.
Bark decoction with rock salt for nasal congestion and breathlessness.
The white variety flower of Palasha has intelligence and memory enhancing property .","Used in medications for gynecological problems and in many deworming medicines.
Its potent skin benefiting qualities and anti-diabetic properties makes it a main ingredient of some medications.
Used for quick wound healing.",https://drive.google.com/drive/folders/1YdvYur9dApIQ_bNyd14vu0k9qcECEXXq,https://www.easyayurveda.com/2012/12/07/palasha-butea-monosperma-medicinal-qualities-ayurveda-details/,"Vaniya Ganiga Samaja Seva Sangha, Perne",
12,Nakshatra,"Nakshatra
Uttara",Plaksha,Ficus virens Aiton,White fig,"Ithi
ഇത്തി","Basari
ಬಸರಿ","Like many figs, its fruits are edible. One of the most famous specimens of this tree is the Curtain Fig Tree of the Atherton Tableland, near Cairns, a popular tourist attraction. Another famous example is the Tree of Knowledge in Darwin.Ficus virens var. sublanceolata occurs the subtropical rainforest of northeastern New South Wales, and south eastern Queensland in Australia. DescriptionIt is a medium-sized tree which grows to a height of 24–27 metres (79–89 ft) In dry areas and up to 32 metres (105 ft) tall in wetter areas.It has two marked growth periods in its Indian environment: in spring (February to early May), and in the time of the monsoon rains (i.e. June to early September). The new leaves are a beautiful shade of reddish pink and very pleasing to the eye.This is a very massive tree in which the size of the crown can sometimes exceed the height of the tree.","The plant of the genus Ficus found in Pakistan, India, Southeast Asia, through Malaysia and into Northern Australia.","The plant has various chemical composition
Phenolic acids: These bioactive compounds contribute to the antioxidant capacity of white figs.
Flavonoids: Including flavonols, flavones, and anthocyanins, which have health-related effects.
Volatile Compounds:
Monoterpenes, sesquiterpenes, norisoprenoids, ketones, alcohols, and esters are present in fig fruits, leaves, spirits, and liqueurs.
Other Components:
Organic acids, triterpenoids, sterols, and fatty acids also play a role in the phytochemical composition of white figs.
These constituents contribute to the nutritional value and potential health benefits associated with white figs. ","White fig which has long been used in Ayurveda, the ancient system of Indian medicine, for various diseases/disorders including diabetes, liver disorders, diarrhea, inflammatory conditions, hemorrhoids, respiratory, and urinary diseases. F. racemosa is pharmacologically studied for various activities including antidiabetic, antipyretic, anti-inflammatory, antitussive, hepatoprotective, and antimicrobial activities.","- A decoction of the bark is used as an injection in the treatment of leucorrhoea.
- Applied externally, a bark decoction is used as a wash on ulcers and as a gargle in salivation.","- Ayurveda chiefly utilizes the latex of the white fig fruit, which contains an enzyme called ficin.
This enzyme possesses powerful anthelmintic properties, making it effective in combating worm infestations.

- White figs are considered diuretic, aiding in promoting urine flow and maintaining kidney health.
They also act as a laxative, assisting in relieving constipation and promoting regular bowel movements.

- The fig fruit is known to have expectorant properties.
It helps in eliminating excess mucus from the throat and provides nutrition to the throat muscles.
This makes it beneficial for sore throats and helps strengthen the throat to prevent relapses1.
Remember, always consult a qualified Ayurvedic practitioner before incorporating any herbal remedies into your health routine",https://drive.google.com/drive/folders/1Peicll9QY3zp2MoNUfBW_aMufbQ8-U2v?usp=drive_link,https://biodiversity.lums.edu.pk/lums-biodiversity/plants/ficus-virens,"Vaniya Ganiga Samaja Seva Sangha, Perne",
13,Nakshatra,"Nakshatra
Hasta",Amrataka,Spondias pinnata (L.f.) Kurz,Hog-Plum,"Ambazham
അമ്പഴം","Ambatte
ಅಂಬಟ್ಟೆ","This versatile plant (Spondias mangifera) has various regional names and is known for its medicinal properties. This is a moderate sized gabrous thin foliged deciduous tree, upto 20-25m in height and 2.5m in grith with straight trunk and horizontal branches. The leaf is 30-45cm long having 1-4 pairs of lateral laeflets in addition to terminals.","They are found in areas of Assam, Bengal, Himalayan regions and karnataka(wild forest areas).  ","The fruit contains beta-amyrin, oleanolic acids and amino acids-glycine, cystine, serine, alanine and leucine:polyseccharides are also present. Aerial parts gave lignoceric acid, 24-methylenecycloartanone, sigmast-4-en-3-one, beta-sitosterol and its glucoside.","The green fruit of Spondias mangifera is useful in biliousness and dyspepsia.The fruit powder also exhibits anti-tubercular properties. It can be used as an astringent, refrigerant, or tonic. The bark of the plant has been traditionally used to treat diabetes. Itb also possesses anticancer, antihistamine, antipyretic, and antispasmodic properties.",Fresh juice of friut of Amrataka helps to treat condition of anorexia and nausea. Juice of leaves of Amrataka is applied locally in earache. The paste of leaves of Spondias pinnata is applied over the joints affected with rheumatism. The decoction of the bark helps in treating diarrhea and regulate menstruation in women.,"Vataghna-useful in treating disorders of vata dosha imbalance such as neuralgia, paralysis, constipation, bloating, etc. Ruchya- improves taste and relieves anorexia. ",https://drive.google.com/drive/folders/1KNApqsnvZE6EDiXdm4CR8rZiJUK8OPE_?usp=drive_link,https://www.easyayurveda.com/2017/12/18/wild-mango-hog-plum-spondias-pinnata/,"Vaniya Ganiga Samaja Seva Sangha, Perne",
14,Nakshatra,"Nakshatra
Chitra / Chitta",Bilva,Aegle marmelos (L.) Corrêa,Bael,"Koovalam
കൂവളം","Bilvapatre
ಬಿಲ್ವಪತ್ರೆ","Bael is a deciduous shrub or small to medium-sized tree, reaching up to 13 meters (43 feet) in height. It has slender drooping branches and an irregular crown. The bark is pale brown or grayish, smooth or finely fissured, and armed with long straight spines. The leaves are trifoliate, alternate, and each leaflet measures 5–14 cm x 2–6 cm. Young leaves are pale green or pinkish, while mature leaves are dark green and smooth.","They are found in areas of Assam, Bengal, Himalayan regions and karnataka(wild forest areas).  ","Furocoumarins- Includes compounds like xanthotoxol and the methyl ester of alloimperatorin. Flavonoids- Flavonoids are known for their antioxidant and anti-inflammatory properties. Alkaloids found in bael include á-fargarine, O-isopentenylhalfordinol, and O-methylhafordinol.","Bael is effective in treating diarrhea and managing cholera. The active constituent called “Feronia gum” present in the bark and branches of the bael tree has potential benefits for diabetes management. Bael is known for its anti-inflammatory and laxative properties. It helps improve digestion, relieve constipation, and soothe the digestive tract.","Bael fruits are loaded with nutrients like vitamins A, B1, B2, C, and essential minerals like calcium and potassium. It serves as a natural antioxidant and supports overall health.","Agni Pittakrut- improves digestion and pitta. Vatashleshmahara- balances vata and kapha. Vatajit- used in dyspepsia, gastritis indigestion, cold and sinusitis.Shulaghna- relieves abdominal colic pain.",https://drive.google.com/drive/folders/1jv1xSAhPilq0IxQ1wQuYYr2rL5LxDOjt?usp=drive_link,https://www.easyayurveda.com/2012/11/26/bael-benefits-full-ayurvedic-description-about-root-fruit-and-stem/,"Vaniya Ganiga Samaja Seva Sangha, Perne",
15,Nakshatra,"Nakshatra
Swathi",Arjuna,Terminalia arjuna (Roxb. ex DC.) Wight & Arn.,"Arjuna, Arjun tree","Neermaruthu
നീർമരുത്","Bilimatti
ಬಿಳಿಮತ್ತಿ","A large tree with a huge buttressed trunk and horizontally spreading branches. Bark is Smooth, Grey, Sap wood is reddish white and heart wood is brown. Leaves are Sub opposite,10- 15 cm long, oblong or elliptic oblong. Flowers are pale yellow which appear between March and June. Fruits are 2.5 to 5 cm, fibrous woody fruit, divided into five wings, appearing between September and November.","The Arjuna is seen across the Indian Subcontinent, and usually found growing on river banks or near dry river beds in Uttar Pradesh, Bihar, Maharashtra, Madhya Pradesh, West Bengal, Odisha and south and central India.","Terminalia arjuna- Arachidic stearate, cerasidin, cerasidin, Arjunic Acid, tannins, Arjunone, Arjunetin, Arjunglucosisdes, I & II; Arjunoside I, II&IV; Arjunolic acid & etc.
Bark: calcium and magnesium salts, flavonoids.","Arjuna is renowned for its cardioprotective effects. It strengthens the heart muscle and supports blood vessels originating from the heart. Arjuna has a positive impact on insulin hormone levels, benefiting diabetes patients.","Useful in bleeding disorders because of its astringent (contraction of skin cells) properties.
It heals fractures and wounds quickly. Used in treating pus in urine, UTI and dysentery.
Relieves ulcers and wounds due to Pitta and Kapha imbalance.Useful in chest injuries, chronic respiratory disorders, tuberculosis.
Relieves tiredness, fatigue and thirst.It is used as an ingredient in tooth powders which  helps to treat bleeding gums.Arjuna decreases LDL levels.
","Arjunarishta – a cardiac tonic, useful in the treatment of chest injury, weakness, feeling tired all the time, chronic respiratory diseases, cough, throat related diseases.
Prabhakar Vati – used in cardiac disorders
Ayaskriti –a fermented preparation, used in anaemia, weight loss therapy, skin diseases etc.
Pushyanuga Churna – used in menorrhagia, diarrhea etc.",15Arjuna - Google Drive,https://www.easyayurveda.com/2014/12/15/terminalia-arjuna-benefits-how-to-use-research-side-effects/,"Vaniya Ganiga Samaja Seva Sangha, Perne",
16,Nakshatra,"Nakshatra
Visakha",Kapittha,Feronia elephantum Corrêa,Elephant apple,"Vilavu
വിലാവു","Naibela
ನಾಯಿಬೇಲ","The kapittha tree grows slowly and is erect, with upward-reaching branches that bend outward near the summit. These branches subdivide into slender branchlets that droop at the tips. The bark is ridged, fissured, and scaly, and the tree bears sharp spines (ranging from 3/4 to 2 inches or 2-5 cm) on some of its zigzag twigs. The leaves are deciduous, alternate, dark green, leathery, and often minutely toothed. When crushed, they emit a slight lemon scent. Dull-red or greenish flowers, about 1/2 inch (1.25 cm) wide, appear in small, loose, terminal or lateral panicles. These flowers are usually bisexual.","Kapittha is native to India and is found throughout the plains, Siwalik range, and forests. It grows at the base of the Himalayas up to an elevation of 450 meters.",Coumarins: The leaves and stem bark of the kapittha tree contain coumarins such as luvangetin and xanthotoxin. Limonin: Another compound found in the plant. Steroids: The kapittha plant contains sitosterol and sitosterol-O-beta-D-glucoside.,"The unripe fruit of kapittha is an excellent remedy for diarrhea and dysentery. It helps calm Kapha dosha, making it beneficial for managing gastrointestinal disturbances. Kapittha improves cardiac muscle strength.",Kapittha clears phlegm from the throat. It aids in managing dyspnea (difficulty in breathing). The ripened fruit of kapittha is consumed to treat thirst and improve overall body strength.,,https://drive.google.com/drive/folders/1wTs2uB0Uij3zdbKurYeTZ5XN8H0NXawz?usp=drive_link,https://www.easyayurveda.com/2018/10/08/raga-and-shadava-qualities-and-health-benefits/,"Vaniya Ganiga Samaja Seva Sangha, Perne",
