Number,Type,Category,Sanskrit Name,Botanical name,English name,Malayalam Name,Kannada Name,Description,Geographical distribution,Chemical constituents,Important Therapeutic use,Other medical uses,Ayurvedic uses ,Google drive Album,Reference/Futher Reading Link,Adopter Name,Adopter contact
8,Navagraha,"Navagraha
Sani / Saturn",Shami,Prosopis cineraria (L.) Druce,Banni Tree,"Vanni
വണ്ണി  ","Banni
ಬನ್ನಿ
","Shami Tree, also called Banni Mara, Khejri tree, is immensely known for its spiritual uses. In Dasara, the 10 day long Hindu festival, on the 10th day, the leaves of this are distributed among one another to share mutual love and respect and to forget past bitterness.Its leaves and flowers are used for worshiping Lord Shiva. Bark is the main usable part of this plant. The holy plant Shami is planted in the premises of the temples, Navagraha vanas and sacred places.",This medium sized tree is found in dry areas. Gujarat and Rajasthan is the main habitat of this plant. The people of Rajasthan and Punjab use its legumes as vegetables; in some part of Maharashtra and Karnataka its fruits are used to feed to the cattle.,"Prosopis cineraria chemical Constituents
Flowers- Patulitrin, Patuletin, prosogerins A,B. Paluritin a flavone glycoside patulitrin prosogerins A, B and C Glucoside patulitrin.
Seeds- Specigerin, fixed oil(4.5%), Prosogerine. Specigerin, fixed oil 4.5% posogerine prosapanal G, Flavone prosogerin C.
The tree contains - 5-hydroxytryptamine, apigenin, isorhamnetin-3-diglucoside, l- arabinose, quercetin, tannin and tryptamine.
Wood ash - 31% of soluble potassium salts, used as a source of potash.
Stem - Ursolic acid, glycosides of campestral, stigmasterol, B- Sitosterol","Bark is the main usable part of this plant. The plant is cold in potency and heavy and dry in nature. It is used to pacify both Kapha and
Pitta dosha.","• It is used for the treatment of vertigo and as a brain tonic.
• A paste of bark is applied to scorpion sting.
• Ash of fruit is applied locally to remove hairs.
• Flowers are mixed with sugar and administered to prevent miscarriage.
• Pods are eaten green, dried or after boiling and are considered to possess astringent, demulcent, and pectoral properties.
• Pods are used as fodder for livestock
• Pulp before ripened is rich in sweetish farinaceous pulp, which is consumed as food especially in times of scarcity.
• During famine bark is used as food
• Bark is ground into flour and made into cakes.
• Bark as well as the galls formed on the leaves are used for tanning.
• Leaves are much used for fodder.
• Leaves are useful for green manuring.",,https://drive.google.com/drive/folders/1OzvxtpggNWmBGzrwvOIcJV1yYO4a5n7C?usp=drive_link,,"Vaniya Ganiga Samaja Seva Sangha, Perne",
9,Navagraha,"Navagraha
Rahu / North Lunar Node",Durva,Cynodon dactylon (L.) Pers.,Bermuda grass,"Karuka
കറുക
","Garike
ಗರಿಕೆ
","Cynodon dactylon, commonly known as Bermuda grass,
is a warm-season perennial grass with prostrate stems
that form a dense mat. It has linear, flat leaves with a
prominent midrib, and its flowering spikes are arranged
in digitate clusters. This grass is highly adaptable, thriving
in various soil conditions and climates. It is often used for
lawns, sports fields, and erosion control due to its resilience
and ability to form a dense sod. In cultural contexts, such
as Hindu traditions, it holds significance and is used in rituals.
","Cynodon dactylon, commonly known
as Bermuda grass, has a wide
geographical distribution and is found
in various regions around the world.
Its natural habitat is believed to be in
warm-season climates.","The plant is reported to contain Phenolic phyto- toxins, ferulic, syringic, p-coumaric, vanillic, p-hydro- xybenzoic and O-hydroxyphenyl acetic acids. The leaves contain tricin, ?avone C- glycosides and avonoid sulphate.","The plant has been long used in the traditional medicines to
treat various ailments such as anasarca, cancer, convulsions,
cough, cramps, diarrhea, dropsy, dysentery, epilepsy, headache,
hemorrhage, hypertension, hysteria, measles, rubella, snakebite,
sores, stones, tumors, urogenital disorders, warts and wounds","• The paste of the durva plant is prepared and applied over fresh wounds and ulcers to control bleeding and quicken the process of healing.
• In conjunctivitis, the fresh juice from the plant Cynodon dactylon is used as eye drops to reduce the reddishness, burning sensation and treat the condition.
• Fresh juice of durva is given in a dose of 15-20 ml in conditions of epileptic seizures and psycho- somatic disorders.
• In conditions of bleeding piles and blood mixed diarrhea, the cold infusion or decoction of Doorva is given in a dose of 50 ml.
• To control bleeding from the nose, the fresh juice of durva is installed as nasal drops.
• To treat conditions of menorrhagia and uterine prolapse, the decoction of durva is given in a dose of 50-60 ml. The decoction controls bleeding and provides strength to the uterine muscles.
• To treat the condition of burning micturition, burning sensation of the body, cold infusion prepared from bermuda grass is given in a dose of 50-60 ml.
• In skin diseases like scabies, herpes and discoloration of the skin, the paste of durva is applied over the affected area.
• In case of scorpion bite, the fresh juice of durva is given in a dose of 30-40 ml to nullify the effect of poison.
• Durva is used in religious functions of Hindu religion; hence it is called Conch grass.","Widely used for its healing properties. It is known to help balance Kapha dosha, making it useful for treating respiratory issues linked to excess Kapha. Its anti-inflammatory qualities make it beneficial for conditions like arthritis. Durva is also used in wound healing, improving digestion, supporting heart health, and managing blood sugar levels, showcasing its broad application in Ayurvedic practices.",https://drive.google.com/drive/folders/1yjBGUU3q41DyWaxb4gmPhG1ra99ODrXK?usp=sharing,,"Vaniya Ganiga Samaja Seva Sangha, Perne",
1,Nakshatra,"Nakshatra
Ashwini",Kupilu,Strychnos nux-vomica  L.,Strychnine tree,"Kanjiram
കാഞ്ഞിരം","Kasarka
ಕಾಸರ್ಕ","
Strychnos nux-vomica L., commonly known as the poison nut or Nux vomica, is a medium-sized tree. The tree bears small, greenish-white flowers and produces orange to red fruits about the size of an apple. These fruits contain seeds that are flat and circular, resembling large, silver coins. The seeds are the most potent part of the plant, containing high concentrations of alkaloids, chiefly strychnine and brucine. Strychnine is a powerful neurotoxin
Note: As per the Drugs And Cosmetics Act, the medicines containing Nux vomica should be taken only under strict medical cunervision","Throughout tropical India, Uttar Pradesh, Bihar, Orissa and west Bengal up to a height of altitude of 1350 m. Hot weather forests - travancore-cochin, madras, konkan - malabar.
The Kupilu tree is native to tropical and subtropical regions of SouthEast Asia and Australia. In India it is found in deciduous and semi evergreen forests of Maharashtra; It is widely found across foothills of Western Ghats.","Strychinine, Vomicine, Brucine, Novacine, Isostrychnine, Cuchiloside and Loganic acid","Dried seeds are nervine, stomachic, and cardio-tonic, aphrodisiac, and respiratory stimulant.","External application- External application of its paste relieves pain, and reduces edema, pus and inflammation. Seed paste is indicated in inflammatory joint diseases like Amavata, Sandhivata (osteoarthritis) etc

Nervous System - Because of its penetrating action it stimulates the nervous system, promoting strength of the nervous system. overdose may cause convulsions. Indicated in insomnia, facial palsy, hemiplegia, nerve related pain etc.

Digestive system - It has carminative, digestive, and absorbent action. It is dry and astringent in taste so reduces saliva secretion, reducing Abdominal cramp. Indicated in low digestive fire, Inflammation of stomach, indigestion, hemorrhoids, helminthiasis, grahani (IBS).

Respiratory System - Being bitter and pungent in taste, it acts as kaphasamaka, and relieves cough.
Indicated in pulmonary oedema, and cough

Circulatory System - Because of its hot and penetrating action, it increases Blood pressure, and stimulates the heart. Indicated in Hridaya saidhilya (Cardiomyopathy), Hridaya dravata (Palpitation),
Heart valve related diseases, etc.

Excretory system -It has stimulative action on the Urinary system, so indicated in weakness of kidnev and associated structures. Indicated in kids bed wetting, urine leakage due to weak bladder.",,https://drive.google.com/drive/folders/1pvsq51nKyu-DfJLOouD9sA0lVWiBH1jB?usp=drive_link,https://www.easyayurveda.com/2014/01/08/kupilu-nux-vomica-uses-dose-purification-side-effects/,"Vaniya Ganiga Samaja Seva Sangha, Perne",
2,Nakshatra,"Nakshatra
Bharani",Amalaki,Phyllanthus emblica L.,Indian gooseberry,"Nelli
നെല്ലി
","Nellikkai
ನೆಲ್ಲಿಕ್ಕಾಯಿ","Amla (Phyllanthus emblica L.) is a small to medium sized deciduous tree belonging to the family Phyllanthaceae. It grows as wild or cultivated throughout tropical India.   It is distinguished by its small stature and the production of yellow-green flowers that give way to round, edible fruits of a similar hue. These fruits, comparable in size to a golf ball, feature a thin peel and a pit. Their flavor is a complex blend of sour, bitter, and astringent notes. Fruits of Amla are considered as best among rejuvenating and anti-aging drugs.","It is widely distributed across India, thriving in the subtropical and tropical climates from the Himalayan foothills in the north to the southern tip in Tamil Nadu and Kerala. It is commonly found in the forests and cultivated in orchards across central and western regions, including Madhya Pradesh, Gujarat, and Rajasthan. The adaptability of Amla allows it to grow in various climatic conditions, making it prevalent in eastern states like West Bengal and the northeastern regions as well.","Phyllanthus emblica L. (Amla) is rich in Vitamin C, tannins (such as emblicanin A and B), flavonoids (like quercetin and kaempferol), and phenolic compounds (including gallic and ellagic acid). ","Antioxidant and anti-inflammatory properties support heart health and prevent chronic diseases.
Immunomodulatory effects enhance the immune system's response to pathogens.
Gastroprotective actions help in treating ulcers and improving digestion.","Balances Doshas: Amla effectively balances all three Doshas - Vata, Pitta, and Kapha. It is particularly beneficial for managing Kapha-related issues like obesity and respiratory diseases, and Pitta imbalances affecting skin and eye health.

Weight Management: Amalaki (Amla) combined with honey is recommended for weight loss, making it an effective remedy for obesity. It is best consumed in the morning to counteract the dominance of Kapha.

Skin and Eye Health: Amla enhances skin complexion and health when mixed with saffron and turmeric. It is also beneficial for improving eyesight, especially when used as part of the Triphala combination, which is more effective than Amla alone.

Respiratory Health: A mixture of Amla powder with spices like cinnamon and turmeric supports respiratory health. It is also useful for conditions like allergic rhinitis and hives when combined with ghee and turmeric.

Digestive Aid: Amla pickle, incorporating mustard oil, salt, curry leaves, green chili, and cumin seeds, aids in improving digestion strength.

Hair Health: A combination of Amla powder and Bhringaraj powder is used to treat gray hair and enhance overall hair health.

General Well-being: Amla acts as a tonic, promoting physical strength, vision maintenance, skin complexion, and intelligence. It is beneficial for urinary ailments, constipation, skin diseases, fever, and excessive thirst due to its cooling, heavy, and sweet properties after digestion.","Vayasthapana - Of all the anti-aging herbs - Amla is the best.
Chakshushya - good for eyes, improves vision Sarvadoshaghna - Balances Vata, Pitta and kapha
It balances Vata due to its sour taste
It balances Pitta dosha due to its sweetness and coldness
It balances Kapha dosha due to dryness and astringent properties.
It is quite similar to Haritaki in quality.
Raktapittaghna - useful in bleeding disorders.
Pramehaghna - Useful in diabetes and urinary tract disorders.
Vrushya - aphrodisiac
Rasayana - anti aging, rejuvenative
Kanthya - useful in throat diseases, improves voice, good for the throat.
Hrudya - good for heart
Daahahara - relieves burning sensation
Jvarahara - useful in fever
Rasayana - anti aging, rejuvenative",https://drive.google.com/drive/folders/1ekwFULZGTaUI0pjBbrku5MByLZhuLEJ4?usp=drive_link,,"Vaniya Ganiga Samaja Seva Sangha, Perne",
3,Nakshatra,"Nakshatra
Krittika",Udumbara,Ficus racemosa L,Cluster fig ,"Atthi
അത്തി
","Atthi
ಅತ್ತಿ
","Cluster fig trees, belong to the Moraceae family. They are known for their unique fruiting habit; the fruits grow in clusters directly from the main trunk and larger branches of the tree, hence the name ""Cluster fig.""
Cluster fig trees can grow up to 25-30 meters in height. They have a wide canopy with large, spreading branches. The leaves are broad, ovate, and have a glossy appearance. The fruit is small, round, and turns from green to red or purple as it ripens.
Unlike other fruit trees, cluster figs do not flower externally. Their flowers are inside the fruit, which provides a home for specific wasps to pollinate them in a unique example of mutualism.","It is predominantly found in South and Southeast Asia, notably in India, Sri Lanka, Bangladesh, and Malaysia, and extends to northern and eastern Australia, as well as parts of eastern and southern Africa","Leaves & Fruits- Gluacol
Fruits- B- Sitosterol, ceryl behenate, Lupeol, Friedelin ",,"For Using on the Skin:
It can help with pain, heal wounds, and reduce swelling.
The sap from the plant helps with swelling, wounds, and more.
The young leaves can be put on the skin to make it look better.
Boiling the leaves in water makes a liquid that can clean wounds and help with mouth problems when used as a mouthwash.
For Taking by Mouth:
Digestive System:
It can soak up substances in the stomach, calming an upset stomach.
Eating the ripe fruit might make worms grow in the intestines.
Boiling the bark in water helps with bleeding from the rear end, trouble absorbing nutrients from food, and more. The sap is also good for young children to help prevent issues when they are getting new teeth.
Blood System:
The bark and fruit help stop bleeding.
Reproductive System:
A special treatment using the bark helps with excessive vaginal discharge, heavy menstrual bleeding, and bleeding at unexpected times. It's also good for keeping a pregnancy healthy and helping the baby grow. The sap helps prevent releasing too soon during sex.
Peeing System:
It makes you pee less and is good for diabetes when using the bark or fruit.
For Heat-Related Problems:
Eating the ripe fruit is good for conditions that make you feel like you're burning up.","Breaks down and expels sputum collection.
Useful in piles, hemorrhoids.
Useful in relieving excessive itching.
Useful in ascites.
Relieves a product of indigestion and altered metabolism.
Improves blood. An excess dose may cause nausea and vomiting.
Improves digestion strength.
Helps to relieve worms and infections in the head and neck region.
Relieves bloating, balances body energy.
Relieves abdominal colic pain.
Relieves hiccups.
Useful in piles, hemorrhoids.
Useful in urticaria, itching, allergic skin rashes.
Useful in fibroids, glandular growths.
Improves taste, relieves lack of appetite.
Useful in cardiac disorders with cholesterol deposition in blood vessels.
Relieves bloating, gaseous distension of the abdomen.
Fruit is sweet in taste, hard to digest, useful in bleeding disorders.
",https://drive.google.com/drive/folders/1y3SZrouXFIbYO4IXWlv5246GP6s44P-E?usp=drive_link,https://www.easyayurveda.com/2014/12/16/udumbar-ficus-racemosa-uses-research-side-effects/,"Vaniya Ganiga Samaja Seva Sangha, Perne",
4,Nakshatra,"Nakshatra
Rohini",Jambu, Syzygium cumini (L.) Skeels,Jamun,"Njaval
ഞാവൽ

","Nerale
ನೇರಳೆ ","Syzygium cumini, also known as Java plum or jamun, is a tropical tree that can reach up to 30 meters in height. Its fruits contain a single, large seed and transition from green to deep purple upon ripening. The seeds, along with other parts of the tree, have been traditionally used for their anti-diabetic properties, making them of significant medicinal interest. Additionally, the seeds are explored for their antioxidant and antimicrobial effects. This tree is not only valued for its edible fruits but also for its potential health benefits.","It is widely distributed across India, thriving in tropical and subtropical regions. It is found from the Himalayas in the north to Tamil Nadu and Kerala in the south, and from Gujarat in the west to West Bengal in the east. This tree adapts well to a variety of soils and climates, often growing along riverbanks, near farms, and in forests. Its presence across diverse ecological zones highlights its adaptability and significance in Indian flora.","Syzygium cumini contains a variety of bioactive compounds including phenolic compounds like anthocyanins and flavonoids, essential oils with cineol and pinene, alkaloids such as jambosine, fatty acids including oleic and linoleic acids, and vitamins like vitamin C and A. ","Jamun is well-known for its potential in managing diabetes. The fruit, seeds, and leaves are used to help lower blood sugar levels due to their hypoglycemic effects","Antioxidant and Anti-inflammatory: The fruit and leaves possess antioxidant properties, helping to combat oxidative stress and inflammation, which are linked to various chronic diseases.

Digestive Health: Jamun is used to improve digestion and treat digestive disorders, thanks to its astringent properties that help in regulating bowel movements and reducing symptoms of dysentery.

Cardiovascular Health: It contributes to heart health by potentially reducing blood pressure and enhancing lipid profiles, thus aiding in the prevention of cardiovascular diseases.","Ayurvedic medicines with Jambu as ingredient:
Puhsyanuga Churna- A powerful herbal powder, used in menstrual disorders.
Musli Khadiradi Kashayam - Another useful medicine for gynecological disorders.
Ushirasav- Used in bleeding disorders, UTI etc.

Sthanika karma (Systemic Acton)
Externally - Styptic, Cures burning sensation, prevents skin diseases. The powder prepared from its bark can be applied to wounds to prevent bleeding. In the case of STDs and specifically Syphilis, the oil extracted from its leaves has been found to possess beneficial effects.
Internally
Digestive system -Fruit has Carminative, digestive, Liver stimulant, and styptic properties. Leaves are effective to cure vomiting. Bark has a styptic property. Over consumption of fruit can cause abdominal distension. Fruit is indicated in loss of appetite, indigestion, abdominal colic, Malabsorption syndrome, etc. Also indicated in chronic diarrhea, Tender leaves are useful in vamana panchakarma procedure.
Circulatory System - Styptic. indicated in menorrhagia, bleeding per rectum etc.
Excretory system - Decreases urine production. Indicated in Madhumeha and in udakameha.",https://drive.google.com/drive/u/3/folders/1ghI1ulxKS0qeLkSePIK_lQzwCbRlSJo7,,"Vaniya Ganiga Samaja Seva Sangha, Perne",
5,Nakshatra,"Nakshatra
Mrigashira",Khadirah,Acacia catechu (L. f.) Willd,Acacia catechu,"Karingali
കരിങ്ങാലി
","Kaggali
ಕಗ್ಗಲಿ ","Senegalia chundra, commonly known as Karingali, is a thorny species of tree in the legume family, native to South Asia. It is recognized for its distinctive dark brown to black heartwood and yellowish sapwood. The heart wood and bark of the Karingali are used in traditional medicine. Karingali is a herb that use Traditionally to prepare drinking water in Kerala.
Karingali is very helpful in detoxifying the body off the accumulated toxins. Having astringent properties, karingali helps to manage the pitta disorders in the body. Several Liver problems and blood disorders can be curbed easily with regulated use of cutch tree wood along with other Liver protective and hematinic herbs.Traditionally used in Ayurvedic medicine, the bark of Karingali is esteemed for its astringent properties and is often employed in dental care, specifically in the making of natural mouthwashes and tooth powders. The tree's tannin-rich bark also finds application in the leather tanning industry, contributing to the production of durable and high-quality leather goods. Ecologically, Senegalia chundra plays a crucial role in its native habitats, providing shelter and food for various species while contributing to the stability and health of the ecosystems.","The tree is abundantly found in MP, Gujarat, Maharashtra, AP, TN and Karnataka, up to 1200 meters from sea level.","10% of acacatechin, quercetin, gum quercitrin","Karingali is a herb that use Traditionally to prepare drinking water in Kerala.
Karingali is very helpful in detoxifying the body off the accumulated toxins. Having astringent properties, karingali helps to manage the pitta disorders in the body.
Several Liver problems and blood disorders can be curbed easily with regulated use of cutch tree wood along with other Liver protective and hematinic herbs.","Bark Decoction for Oral and Skin Health: A decoction made from the dried bark of Karingali is used for gargling to treat conditions like stomatitis and gingivitis. When taken orally, this decoction aids in the treatment of various skin diseases such as eczema, scabies, and dermatosis by leveraging its astringent and healing properties.

Dusting Powder for Healing Ulcers and Wounds: The bark is also dried and powdered to be used as a dusting powder on wounds and ulcers. This application promotes faster healing, demonstrating the bark's antibacterial and anti-inflammatory qualities.

Khadira Remedy for Acne and Blackheads: A herbal paste combining Khadira (likely another term for Senegalia chundra), Nimba (Neem), and Daruharidra (Berberis aristata) is applied topically to improve complexion and treat acne, comedones, and blackheads. This remedy highlights the plant's efficacy in managing skin blemishes and enhancing skin health.

Acacia Remedy for Blisters in Children: A mixture of Khadira and Raktachandana (red sandalwood) is prepared as a paste to treat blisters in young children and neonates, showcasing its gentle yet effective healing capability for sensitive skin conditions.

Khadira Remedy for Washing Wounds: A decoction made from Khadira, Neem, and Giloy (Tinospora cordifolia) is used for washing chronic ulcers and wounds. This use underscores the plant's role in wound management, aiding in the early healing of chronic skin lesions through its antimicrobial and regenerative properties.",,https://drive.google.com/drive/folders/1C_lHn0REsxBlBvPztVqCzMsa9GDvyWxR?usp=sharing,,"Vaniya Ganiga Samaja Seva Sangha, Perne",
6,Nakshatra,"Nakshatra
Aardra",Sinshapa,Dalbergia sissoo DC.,Indian Roosewood,"Iruvil
ഇരുവിൽ","Biridi
ಬಿರಿಡಿ","Dalbergia sissoo, also known as North Indian rosewood or shisham, is a fast-growing deciduous tree native to the Indian subcontinent and southern Iran. It's a large tree with a crooked shape, featuring long, leathery leaves and flowers that are white or pink. This tree, which varies in size from medium to large, has a light crown and reproduces through seeds and suckers.The tree is not only valued for its aesthetic appeal but also for its durable and highly workable wood, which is extensively used in furniture making, cabinetry, and veneer production. ","It has a broad distribution that primarily spans the foothills of the Himalayas, ranging from Afghanistan in the west through Pakistan, Nepal, and India, to Bihar in the east. It also naturally occurs in parts of Iran","Leaves - Biochanin A, tectorigenin
Stem bark- Iso Tectorigenin,
Ethanolic extract of bark contains carbohydrates, proteins, amino acids, phenolic compounds, and flavonoids.
Heartwood- Dalberg Phenol, Delbergenone, Dalbergin, Methyl dalbergin (JLN Sastry)","Decoction of leaves is used in the treatment of gonorrhea.
Wood is used for the treatment of leprosy, boils, and vomiting.
Bark is used for treating Vata disorders such as sciatica, hemiplegia
","Root is used for treating diarrhea, dysentery.
Heart wood is used for treating herpes, vitiligo, fever.
Shimshapa Sara ksheerapaka is indicated in treating fever (Sushruta)
Shisham taila - Its oil is applied externally to treat infested wounds, sinuses.
Leaf juice extract is used for treating secondary amenorrhea.
Its heartwood is useful in correction of lipid profile - lowering LDL and VLDL and increasing HDL.",,https://drive.google.com/drive/folders/1VD9qwQamsmTIdlyQW17yZe4mYPPqOS4m?usp=drive_link,"Dalbergia sissoo: Shimshapa Uses, Research, Side Effects (easyayurveda.com)","Vaniya Ganiga Samaja Seva Sangha, Perne",
